schema_version	class_id	display_label	definition_status	defining_source_symbols_json	primary_supported_exact_term_count_for_signature	primary_supported_unique_copy_burden	representative_exact_terms_json	interpretation	statistical_status	summary_role
chm13-physical-copy-ontology-v7-community-attribution-v1.0	DUX4_ZGA_TRANSCRIPTION_NUCLEAR_ENVELOPE_CELL_CYCLE	DUX4 / ZGA / transcription / nuclear envelope / cell cycle	PRIMARY_SUPPORTED	"[""DUX4""]"	72	65	"[{""collection"":""GO_BP"",""relation"":""direct"",""term_id"":""GO:0070317"",""term_name"":""negative regulation of G0 to G1 transition""},{""collection"":""Reactome"",""relation"":""direct"",""term_id"":""R-HSA-9819196"",""term_name"":""Zygotic genome activation (ZGA)""},{""collection"":""GO_MF"",""relation"":""direct"",""term_id"":""GO:0000977"",""term_name"":""RNA polymerase II transcription regulatory region sequence-specific DNA binding""},{""collection"":""GO_CC"",""relation"":""direct"",""term_id"":""GO:0031965"",""term_name"":""nuclear membrane""}]"	DUX4-source physical copies carrying exact ZGA, transcription, nuclear-envelope, and cell-cycle terms.	DISPLAY_ONLY_NO_NEW_P_VALUE_V7_DECISIONS_UNCHANGED	POST_INFERENCE_DISPLAY_ONLY_NOT_A_HYPOTHESIS_OR_TEST
chm13-physical-copy-ontology-v7-community-attribution-v1.0	WASH_ENDOSOMAL_ACTIN_EXOCYST	WASH / endosomal actin / exocyst	PRIMARY_SUPPORTED	"[""WASHC1""]"	47	10	"[{""collection"":""GO_CC"",""relation"":""direct"",""term_id"":""GO:0071203"",""term_name"":""WASH complex""},{""collection"":""GO_CC"",""relation"":""direct"",""term_id"":""GO:0000145"",""term_name"":""exocyst""},{""collection"":""GO_BP"",""relation"":""direct"",""term_id"":""GO:0034314"",""term_name"":""Arp2/3 complex-mediated actin nucleation""},{""collection"":""GO_BP"",""relation"":""direct"",""term_id"":""GO:0016197"",""term_name"":""endosomal transport""}]"	WASHC1-source copies carrying exact WASH-complex, exocyst, actin-nucleation, and endosomal-transport terms.	DISPLAY_ONLY_NO_NEW_P_VALUE_V7_DECISIONS_UNCHANGED	POST_INFERENCE_DISPLAY_ONLY_NOT_A_HYPOTHESIS_OR_TEST
chm13-physical-copy-ontology-v7-community-attribution-v1.0	DDX11_HELICASE_CHROMOSOME	DDX11 / helicase / chromosome	PRIMARY_SUPPORTED	"[""DDX11""]"	90	10	"[{""collection"":""GO_MF"",""relation"":""direct"",""term_id"":""GO:0043139"",""term_name"":""5'-3' DNA helicase activity""},{""collection"":""GO_MF"",""relation"":""direct"",""term_id"":""GO:0160225"",""term_name"":""G-quadruplex unwinding activity""},{""collection"":""GO_BP"",""relation"":""direct"",""term_id"":""GO:0034085"",""term_name"":""establishment of sister chromatid cohesion""},{""collection"":""GO_BP"",""relation"":""direct"",""term_id"":""GO:1990700"",""term_name"":""nucleolar chromatin organization""}]"	DDX11-source copies carrying exact helicase, G-quadruplex, cohesion, and chromatin terms.	DISPLAY_ONLY_NO_NEW_P_VALUE_V7_DECISIONS_UNCHANGED	POST_INFERENCE_DISPLAY_ONLY_NOT_A_HYPOTHESIS_OR_TEST
chm13-physical-copy-ontology-v7-community-attribution-v1.0	RPL23A_RIBOSOMAL_NUCLEOLAR	RPL23A / ribosomal / nucleolar	PRIMARY_SUPPORTED	"[""RPL23A""]"	22	11	"[{""collection"":""GO_CC"",""relation"":""direct"",""term_id"":""GO:0005730"",""term_name"":""nucleolus""},{""collection"":""GO_MF"",""relation"":""direct"",""term_id"":""GO:0019843"",""term_name"":""rRNA binding""}]"	RPL23A-source copies carrying exact nucleolus and rRNA-binding terms.	DISPLAY_ONLY_NO_NEW_P_VALUE_V7_DECISIONS_UNCHANGED	POST_INFERENCE_DISPLAY_ONLY_NOT_A_HYPOTHESIS_OR_TEST
chm13-physical-copy-ontology-v7-community-attribution-v1.0	SEPTIN14_SEPTIN_CYTOKINESIS	SEPTIN14 / septin / cytokinesis	PRIMARY_SUPPORTED	"[""SEPTIN14"",""SEPTIN14P20""]"	63	20	"[{""collection"":""GO_CC"",""relation"":""direct"",""term_id"":""GO:0031105"",""term_name"":""septin complex""},{""collection"":""GO_CC"",""relation"":""direct"",""term_id"":""GO:0005940"",""term_name"":""septin ring""},{""collection"":""GO_BP"",""relation"":""direct"",""term_id"":""GO:0061640"",""term_name"":""cytoskeleton-dependent cytokinesis""},{""collection"":""GO_BP"",""relation"":""ancestor"",""term_id"":""GO:0000910"",""term_name"":""cytokinesis""},{""collection"":""GO_BP"",""relation"":""direct"",""term_id"":""GO:1905719"",""term_name"":""protein localization to perinuclear region of cytoplasm""}]"	SEPTIN14-source copies carrying exact septin, cytokinesis, and perinuclear-localization terms.	DISPLAY_ONLY_NO_NEW_P_VALUE_V7_DECISIONS_UNCHANGED	POST_INFERENCE_DISPLAY_ONLY_NOT_A_HYPOTHESIS_OR_TEST
chm13-physical-copy-ontology-v7-community-attribution-v1.0	WBP1L_CXCL12_SIGNALING	WBP1L / CXCL12 signaling	PRIMARY_SUPPORTED	"[""WBP1L""]"	14	14	"[{""collection"":""GO_BP"",""relation"":""direct"",""term_id"":""GO:0038160"",""term_name"":""CXCL12-activated CXCR4 signaling pathway""},{""collection"":""GO_BP"",""relation"":""ancestor"",""term_id"":""GO:0038146"",""term_name"":""chemokine (C-X-C motif) ligand 12 signaling pathway""},{""collection"":""GO_BP"",""relation"":""ancestor"",""term_id"":""GO:0038159"",""term_name"":""C-X-C chemokine receptor CXCR4 signaling pathway""}]"	WBP1L-source copies carrying exact CXCL12/CXCR4 signaling terms. The exact perinuclear-localization term has a SEPTIN14 contributor signature and is therefore retained in the SEPTIN14 class, not merged here.	DISPLAY_ONLY_NO_NEW_P_VALUE_V7_DECISIONS_UNCHANGED	POST_INFERENCE_DISPLAY_ONLY_NOT_A_HYPOTHESIS_OR_TEST
