submitted_utc	run_id	job_id	state	node_or_reason	submit_command	log_stdout	log_stderr	note
2026-06-25T16:24:53Z	wfmash_p95_updated_bin_l2000	1706563	RUNNING	octopus07	sbatch paper_prep/_brainstorming/fig5_whole_genome_graph_untangle_pilot/scripts/run_graph_untangle_one.sbatch wfmash_p95_updated_bin_l2000	paper_prep/_brainstorming/fig5_whole_genome_graph_untangle_pilot/logs/fig5_wg_graph_untangle.1706563.out	paper_prep/_brainstorming/fig5_whole_genome_graph_untangle_pilot/logs/fig5_wg_graph_untangle.1706563.err	Primary WFMASH 2kb query-grid 1:1 ANI graph/untangle pilot submitted by agent-2748.
2026-06-25T16:27:29Z	wfmash_p95_updated_bin_l2000	1706563	CANCELED	octopus07	scancel 1706563	paper_prep/_brainstorming/fig5_whole_genome_graph_untangle_pilot/logs/fig5_wg_graph_untangle.1706563.out	paper_prep/_brainstorming/fig5_whole_genome_graph_untangle_pilot/logs/fig5_wg_graph_untangle.1706563.err	Canceled after stderr showed seqwish was given a sequence filename list rather than one FASTA; script patched to concatenate exact query and target FASTAs before seqwish.
2026-06-25T16:27:21Z	wfmash_p95_updated_bin_l2000	1706564	RUNNING	octopus07	sbatch paper_prep/_brainstorming/fig5_whole_genome_graph_untangle_pilot/scripts/run_graph_untangle_one.sbatch wfmash_p95_updated_bin_l2000	paper_prep/_brainstorming/fig5_whole_genome_graph_untangle_pilot/logs/fig5_wg_graph_untangle.1706564.out	paper_prep/_brainstorming/fig5_whole_genome_graph_untangle_pilot/logs/fig5_wg_graph_untangle.1706564.err	Corrected WFMASH pilot with query and target FASTAs concatenated into one seqwish input FASTA in /dev/shm.
2026-06-25T16:28:21Z	wfmash_p95_updated_bin_l2000	1706564	FAILED	octopus07	automatic Slurm failure	paper_prep/_brainstorming/fig5_whole_genome_graph_untangle_pilot/logs/fig5_wg_graph_untangle.1706564.out	paper_prep/_brainstorming/fig5_whole_genome_graph_untangle_pilot/logs/fig5_wg_graph_untangle.1706564.err	Failed during staging because /dev/shm scratch ran out of space while writing the concatenated whole-genome FASTA; script patched to default GRAPH_SCRATCH_ROOT to work/tmp on MooseFS.
2026-06-25T16:29:18Z	wfmash_p95_updated_bin_l2000	1706565	RUNNING	octopus07	sbatch paper_prep/_brainstorming/fig5_whole_genome_graph_untangle_pilot/scripts/run_graph_untangle_one.sbatch wfmash_p95_updated_bin_l2000	paper_prep/_brainstorming/fig5_whole_genome_graph_untangle_pilot/logs/fig5_wg_graph_untangle.1706565.out	paper_prep/_brainstorming/fig5_whole_genome_graph_untangle_pilot/logs/fig5_wg_graph_untangle.1706565.err	Running with default scratch_root under work/tmp on MooseFS; command manifest showed 96T available at startup.
